{
  "schema_version":1,
  "status":"reference_refresh_recommended",
  "source_run_id":"R2a_PALOD_k16_r0_e66e8517f8ac5dad",
  "source_schema_version":3,
  "source_iterations_fingerprint":"fnv1a64:6a9c2a89844e639b",
  "config_hash":"59d030e192f7da5a",
  "case":"R2a",
  "method":"PALOD",
  "wavenumber":16,
  "base_reference_level":10,
  "audit_reference_level":11,
  "base_reference_nodes":1089,
  "audit_reference_nodes":2113,
  "terminal_reference_error":0.0060549155145160297,
  "relative_reference_difference":0.092601660206206263,
  "terminal_error_fraction":15.29363374009157,
  "maximum_terminal_error_fraction":0.25,
  "reference_refresh_recommended":true,
  "base_cache_hit":false,
  "audit_cache_hit":false,
  "base_cache_key":"7e1af548b6dd926d",
  "audit_cache_key":"e8435955ae8d8362",
  "evaluation_seconds":0.174435534
}
